source,citation,date_accessed
Global Invasive Species Database,Global Invasive Species Database (http://www.issg.org/database),4/23/20
Invasive Species Compendium,"CABI, 2021. Invasive Species Compendium. Wallingford, UK: CAB International. www.cabi.org/isc.",4/24/20
The Center for Invasive Species and Ecosystem Health,invasive.org,4/24/20
Invasive alien species in Southeast Asia,"Invasive alien species in Southeast Asia Archived 2008-12-30 at the Wayback Machine. MacKinnon, John R. Asean Biodiversity, October–December 2002.",4/24/20
Japan Ministry of the Environment,Alien species recognized to be established in Japan or found in the Japanese wild. Japan Ministry of the Environment. 2004-10-27. ,4/24/20
World Conservation Union,The Status of Alien Invasive Species in Bangladesh and their Impact on the Ecosystems. World Conservation Union.,4/24/20
European Alien Species Conservation Network,"Stelios Katsanevakis, Ivan Deriu, Fabio D’Amico, Ana Luísa Nunes, Sara Pelaez Sanchez, Fabio Crocetta, Margarita Arianoutsou, Ioannis Bazos, Anastasia Christopoulou, Giovanna Curto, Pinelopi Delipetrou, Yannis Kokkoris, Vadim Panov, Wolfgang Rabitsch, Alain Roques, Riccardo Scalera, Susan M. Shirley, Elena Tricarico, Andrea Vannini, Argyro Zenetos, Sevasti Zervou, Andreas Zikos and Ana Cristina Cardoso. European Alien Species Information Network (EASIN): supporting European policies and scientific research (pp 147-157)",4/24/20
,,